{
  "$schema": "https://json-schema.org/draft/2020-12/schema",
  "$id": "https://adamgetchell.org/CDT-plusplus/reference/schema/fixture-v1.schema.json",
  "title": "CDT++ cross-language fixture protocol v1",
  "type": "object",
  "additionalProperties": false,
  "required": [
    "schema_version",
    "fixture_set",
    "canonicalization",
    "units",
    "tolerances",
    "comparison_policy",
    "state_fixtures",
    "transitions",
    "persistence",
    "bounded_run"
  ],
  "properties": {
    "schema_version": {
      "const": 1
    },
    "fixture_set": {
      "type": "string",
      "pattern": "^[a-z0-9-]+-v[0-9]+$"
    },
    "canonicalization": {
      "$ref": "#/$defs/canonicalization"
    },
    "units": {
      "$ref": "#/$defs/units"
    },
    "tolerances": {
      "type": "object",
      "minProperties": 1,
      "additionalProperties": {
        "$ref": "#/$defs/tolerance"
      }
    },
    "comparison_policy": {
      "$ref": "#/$defs/comparisonPolicy"
    },
    "state_fixtures": {
      "type": "array",
      "minItems": 1,
      "items": {
        "$ref": "#/$defs/stateFixture"
      }
    },
    "transitions": {
      "type": "array",
      "minItems": 5,
      "items": {
        "$ref": "#/$defs/transition"
      }
    },
    "persistence": {
      "$ref": "#/$defs/persistence"
    },
    "bounded_run": {
      "$ref": "#/$defs/boundedRun"
    }
  },
  "$defs": {
    "nonemptyString": {
      "type": "string",
      "minLength": 1
    },
    "stringArray": {
      "type": "array",
      "minItems": 1,
      "uniqueItems": true,
      "items": {
        "$ref": "#/$defs/nonemptyString"
      }
    },
    "command": {
      "type": "array",
      "minItems": 1,
      "items": {
        "$ref": "#/$defs/nonemptyString"
      }
    },
    "canonicalization": {
      "type": "object",
      "additionalProperties": false,
      "required": [
        "vertices",
        "edges",
        "facets",
        "cells",
        "adjacency",
        "floating_point"
      ],
      "properties": {
        "vertices": {
          "$ref": "#/$defs/nonemptyString"
        },
        "edges": {
          "$ref": "#/$defs/nonemptyString"
        },
        "facets": {
          "$ref": "#/$defs/nonemptyString"
        },
        "cells": {
          "$ref": "#/$defs/nonemptyString"
        },
        "adjacency": {
          "$ref": "#/$defs/nonemptyString"
        },
        "floating_point": {
          "$ref": "#/$defs/nonemptyString"
        }
      }
    },
    "units": {
      "type": "object",
      "additionalProperties": false,
      "required": [
        "coordinates",
        "time",
        "regge_action",
        "action_delta",
        "probability",
        "benchmark_duration"
      ],
      "properties": {
        "coordinates": {
          "const": "initial_radius"
        },
        "time": {
          "const": "timeslice"
        },
        "regge_action": {
          "const": "dimensionless"
        },
        "action_delta": {
          "const": "dimensionless"
        },
        "probability": {
          "const": "unit_interval"
        },
        "benchmark_duration": {
          "const": "nanoseconds"
        }
      }
    },
    "tolerance": {
      "type": "object",
      "additionalProperties": false,
      "required": [
        "absolute",
        "relative",
        "rationale"
      ],
      "properties": {
        "absolute": {
          "type": "number",
          "minimum": 0
        },
        "relative": {
          "type": "number",
          "minimum": 0
        },
        "rationale": {
          "$ref": "#/$defs/nonemptyString"
        }
      }
    },
    "comparisonPolicy": {
      "type": "object",
      "additionalProperties": false,
      "required": [
        "exact",
        "numerical",
        "implementation_specific",
        "unsupported"
      ],
      "properties": {
        "exact": {
          "$ref": "#/$defs/stringArray"
        },
        "numerical": {
          "type": "object",
          "minProperties": 1,
          "additionalProperties": {
            "$ref": "#/$defs/nonemptyString"
          }
        },
        "implementation_specific": {
          "$ref": "#/$defs/stringArray"
        },
        "unsupported": {
          "$ref": "#/$defs/stringArray"
        }
      }
    },
    "position": {
      "type": "array",
      "minItems": 3,
      "maxItems": 3,
      "items": {
        "type": "number"
      }
    },
    "stateFixture": {
      "type": "object",
      "additionalProperties": false,
      "required": [
        "id",
        "source",
        "expected_state"
      ],
      "properties": {
        "id": {
          "$ref": "#/$defs/nonemptyString"
        },
        "source": {
          "$ref": "#/$defs/nonemptyString"
        },
        "expected_state": {
          "$ref": "#/$defs/nonemptyString"
        },
        "input_state": {
          "$ref": "#/$defs/nonemptyString"
        },
        "removed_vertex": {
          "type": "object",
          "additionalProperties": false,
          "required": [
            "position",
            "time"
          ],
          "properties": {
            "position": {
              "$ref": "#/$defs/position"
            },
            "time": {
              "type": "integer"
            }
          }
        }
      }
    },
    "site": {
      "type": "object",
      "additionalProperties": false,
      "required": [
        "kind",
        "entity",
        "vertices"
      ],
      "properties": {
        "kind": {
          "enum": [
            "2-2-cell",
            "timelike-edge",
            "1-3-cell",
            "degree-five-vertex",
            "spacelike-edge"
          ]
        },
        "entity": {
          "type": "string",
          "pattern": "^[vecf][0-9]{2,}$"
        },
        "vertices": {
          "type": "array",
          "minItems": 1,
          "maxItems": 4,
          "uniqueItems": true,
          "items": {
            "type": "string",
            "pattern": "^v[0-9]{2,}$"
          }
        },
        "shared_spacelike_facet": {
          "type": "string",
          "pattern": "^f[0-9]{2,}$"
        },
        "reverse_vertices": {
          "type": "array",
          "minItems": 2,
          "maxItems": 2,
          "uniqueItems": true,
          "items": {
            "type": "string",
            "pattern": "^v[0-9]{2,}$"
          }
        }
      }
    },
    "parameters": {
      "type": "object",
      "additionalProperties": false,
      "required": [
        "alpha",
        "k",
        "lambda"
      ],
      "properties": {
        "alpha": {
          "type": "number"
        },
        "k": {
          "type": "number"
        },
        "lambda": {
          "type": "number"
        }
      }
    },
    "transition": {
      "type": "object",
      "additionalProperties": false,
      "required": [
        "id",
        "move",
        "before",
        "proposed",
        "site",
        "parameters",
        "proposal_probability",
        "reverse_probability",
        "action_delta",
        "acceptance_probability",
        "acceptance_variate",
        "accepted",
        "committed"
      ],
      "properties": {
        "id": {
          "$ref": "#/$defs/nonemptyString"
        },
        "move": {
          "enum": [
            "2-3",
            "3-2",
            "2-6",
            "6-2",
            "4-4"
          ]
        },
        "before": {
          "$ref": "#/$defs/nonemptyString"
        },
        "proposed": {
          "$ref": "#/$defs/nonemptyString"
        },
        "site": {
          "$ref": "#/$defs/site"
        },
        "parameters": {
          "$ref": "#/$defs/parameters"
        },
        "proposal_probability": {
          "type": "number",
          "exclusiveMinimum": 0,
          "maximum": 1
        },
        "reverse_probability": {
          "type": "number",
          "exclusiveMinimum": 0,
          "maximum": 1
        },
        "action_delta": {
          "type": "number"
        },
        "acceptance_probability": {
          "type": "number",
          "minimum": 0,
          "maximum": 1
        },
        "acceptance_variate": {
          "type": "number",
          "minimum": 0,
          "maximum": 1
        },
        "accepted": {
          "type": "boolean"
        },
        "committed": {
          "$ref": "#/$defs/nonemptyString"
        }
      }
    },
    "persistence": {
      "type": "object",
      "additionalProperties": false,
      "required": [
        "id",
        "command",
        "expected"
      ],
      "properties": {
        "id": {
          "$ref": "#/$defs/nonemptyString"
        },
        "command": {
          "$ref": "#/$defs/command"
        },
        "expected": {
          "$ref": "#/$defs/stringArray"
        }
      }
    },
    "fVectorBand": {
      "type": "object",
      "additionalProperties": false,
      "required": [
        "minimum",
        "maximum",
        "rationale"
      ],
      "properties": {
        "minimum": {
          "$ref": "#/$defs/fVector"
        },
        "maximum": {
          "$ref": "#/$defs/fVector"
        },
        "rationale": {
          "$ref": "#/$defs/nonemptyString"
        }
      }
    },
    "fVector": {
      "type": "array",
      "prefixItems": [
        {
          "type": "integer",
          "minimum": 0
        },
        {
          "type": "integer",
          "minimum": 0
        },
        {
          "type": "integer",
          "minimum": 0
        },
        {
          "type": "integer",
          "minimum": 0
        }
      ],
      "items": false
    },
    "boundedRun": {
      "type": "object",
      "additionalProperties": false,
      "required": [
        "id",
        "command",
        "exact",
        "bands"
      ],
      "properties": {
        "id": {
          "$ref": "#/$defs/nonemptyString"
        },
        "command": {
          "$ref": "#/$defs/command"
        },
        "exact": {
          "$ref": "#/$defs/stringArray"
        },
        "bands": {
          "type": "object",
          "additionalProperties": false,
          "required": [
            "randomized_cgal_f_vector"
          ],
          "properties": {
            "randomized_cgal_f_vector": {
              "$ref": "#/$defs/fVectorBand"
            }
          }
        }
      }
    }
  }
}
